{"action_catalog":{"allow_outbound":{"destination_required":true,"state_changing":true},"modify_firewall":{"destination_required":true,"state_changing":true},"query_network":{"destination_required":false,"state_changing":false},"query_status":{"destination_required":false,"state_changing":false},"read_logs":{"destination_required":false,"state_changing":false}},"agents":{"appr-agent-01":{"mission_type":"training_observation","profile_id":"appr-agent-01","role":"apprentice"},"cyber-agent-04":{"mission_type":"network_investigation","profile_id":"cyber-agent-04","role":"cyber_defense"},"dr-agent-01":{"mission_type":"demand_response","profile_id":"dr-agent-01","role":"energy_manager"},"elec-agent-01":{"mission_type":"power_distribution","profile_id":"elec-agent-01","role":"electrician"},"elec-agent-02":{"mission_type":"power_distribution","profile_id":"elec-agent-02","role":"electrician"},"maint-agent-01":{"mission_type":"predictive_maintenance","profile_id":"maint-agent-01","role":"facility_maintenance"},"microgrid-agent-01":{"mission_type":"microgrid_dispatch","profile_id":"microgrid-agent-01","role":"power_production"},"vendor-agent-01":{"mission_type":"scada_maintenance","profile_id":"vendor-agent-01","role":"vendor_support"}},"cohorts":[{"mission_type":"training_observation","profile_id":"apprentice-training_observation-cohort","role":"apprentice"},{"mission_type":"network_investigation","profile_id":"cyber_defense-network_investigation-cohort","role":"cyber_defense"},{"mission_type":"power_distribution","profile_id":"electrician-power_distribution-cohort","role":"electrician"},{"mission_type":"demand_response","profile_id":"energy_manager-demand_response-cohort","role":"energy_manager"},{"mission_type":"predictive_maintenance","profile_id":"facility_maintenance-predictive_maintenance-cohort","role":"facility_maintenance"},{"mission_type":"microgrid_dispatch","profile_id":"power_production-microgrid_dispatch-cohort","role":"power_production"},{"mission_type":"scada_maintenance","profile_id":"vendor_support-scada_maintenance-cohort","role":"vendor_support"}],"feature_schema_version":"cyber-behavior-v1","package_id":"ops-sentinel","profiles":{"appr-agent-01":{"action_counts":{"allow_outbound":0,"modify_firewall":0,"query_network":0,"query_status":55,"read_logs":45},"mission_type":"training_observation","role":"apprentice","targets":["FEEDER-A-RTU"],"transitions":{"query_status":{"query_status":2,"read_logs":8},"read_logs":{"query_status":7,"read_logs":3}}},"apprentice-training_observation-cohort":{"action_counts":{"allow_outbound":0,"modify_firewall":0,"query_network":0,"query_status":55,"read_logs":45},"mission_type":"training_observation","role":"apprentice","targets":["FEEDER-A-RTU"],"transitions":{"query_status":{"query_status":2,"read_logs":8},"read_logs":{"query_status":7,"read_logs":3}}},"cyber-agent-04":{"action_counts":{"allow_outbound":2,"modify_firewall":3,"query_network":20,"query_status":25,"read_logs":50},"mission_type":"network_investigation","role":"cyber_defense","targets":["SCADA-HMI-02","TRIRIGA-APP-01"],"transitions":{"allow_outbound":{"query_status":5},"modify_firewall":{"query_status":5},"query_network":{"allow_outbound":1,"modify_firewall":1,"read_logs":8},"query_status":{"query_network":9,"read_logs":1},"read_logs":{"query_network":2,"query_status":8}}},"cyber_defense-network_investigation-cohort":{"action_counts":{"allow_outbound":2,"modify_firewall":3,"query_network":20,"query_status":25,"read_logs":50},"mission_type":"network_investigation","role":"cyber_defense","targets":["SCADA-HMI-02","TRIRIGA-APP-01"],"transitions":{"allow_outbound":{"query_status":5},"modify_firewall":{"query_status":5},"query_network":{"allow_outbound":1,"modify_firewall":1,"read_logs":8},"query_status":{"query_network":9,"read_logs":1},"read_logs":{"query_network":2,"query_status":8}}},"dr-agent-01":{"action_counts":{"allow_outbound":0,"modify_firewall":0,"query_network":8,"query_status":70,"read_logs":22},"mission_type":"demand_response","role":"energy_manager","targets":["METER-GW-01"],"transitions":{"query_network":{"query_status":9,"read_logs":1},"query_status":{"query_network":1,"query_status":7,"read_logs":2},"read_logs":{"query_status":9,"read_logs":1}}},"elec-agent-01":{"action_counts":{"allow_outbound":0,"modify_firewall":0,"query_network":4,"query_status":62,"read_logs":38},"mission_type":"power_distribution","role":"electrician","targets":["FEEDER-A-RTU","FEEDER-B-RTU","METER-GW-01"],"transitions":{"query_network":{"query_status":8,"read_logs":2},"query_status":{"query_network":1,"query_status":6,"read_logs":5},"read_logs":{"query_status":9,"read_logs":1}}},"elec-agent-02":{"action_counts":{"allow_outbound":0,"modify_firewall":0,"query_network":4,"query_status":62,"read_logs":38},"mission_type":"power_distribution","role":"electrician","targets":["BESS-CTRL-02","FEEDER-A-RTU","FEEDER-B-RTU"],"transitions":{"query_network":{"query_status":8,"read_logs":2},"query_status":{"query_network":1,"query_status":6,"read_logs":5},"read_logs":{"query_status":9,"read_logs":1}}},"electrician-power_distribution-cohort":{"action_counts":{"allow_outbound":0,"modify_firewall":0,"query_network":4,"query_status":62,"read_logs":38},"mission_type":"power_distribution","role":"electrician","targets":["BESS-CTRL-02","FEEDER-A-RTU","FEEDER-B-RTU","METER-GW-01"],"transitions":{"query_network":{"query_status":8,"read_logs":2},"query_status":{"query_network":1,"query_status":6,"read_logs":5},"read_logs":{"query_status":9,"read_logs":1}}},"energy_manager-demand_response-cohort":{"action_counts":{"allow_outbound":0,"modify_firewall":0,"query_network":8,"query_status":70,"read_logs":22},"mission_type":"demand_response","role":"energy_manager","targets":["METER-GW-01"],"transitions":{"query_network":{"query_status":9,"read_logs":1},"query_status":{"query_network":1,"query_status":7,"read_logs":2},"read_logs":{"query_status":9,"read_logs":1}}},"facility_maintenance-predictive_maintenance-cohort":{"action_counts":{"allow_outbound":0,"modify_firewall":0,"query_network":12,"query_status":33,"read_logs":55},"mission_type":"predictive_maintenance","role":"facility_maintenance","targets":["BUILDER-SVC-01","TRIRIGA-APP-01","WO-API-01"],"transitions":{"query_network":{"query_status":2,"read_logs":8},"query_status":{"query_network":2,"query_status":1,"read_logs":7},"read_logs":{"query_network":1,"query_status":5,"read_logs":4}}},"maint-agent-01":{"action_counts":{"allow_outbound":0,"modify_firewall":0,"query_network":12,"query_status":33,"read_logs":55},"mission_type":"predictive_maintenance","role":"facility_maintenance","targets":["BUILDER-SVC-01","TRIRIGA-APP-01","WO-API-01"],"transitions":{"query_network":{"query_status":2,"read_logs":8},"query_status":{"query_network":2,"query_status":1,"read_logs":7},"read_logs":{"query_network":1,"query_status":5,"read_logs":4}}},"microgrid-agent-01":{"action_counts":{"allow_outbound":0,"modify_firewall":0,"query_network":12,"query_status":58,"read_logs":30},"mission_type":"microgrid_dispatch","role":"power_production","targets":["BESS-CTRL-02","SPIDERS-MGC-01"],"transitions":{"query_network":{"query_status":7,"read_logs":3},"query_status":{"query_network":1,"query_status":5,"read_logs":4},"read_logs":{"query_network":2,"query_status":8}}},"power_production-microgrid_dispatch-cohort":{"action_counts":{"allow_outbound":0,"modify_firewall":0,"query_network":12,"query_status":58,"read_logs":30},"mission_type":"microgrid_dispatch","role":"power_production","targets":["BESS-CTRL-02","SPIDERS-MGC-01"],"transitions":{"query_network":{"query_status":7,"read_logs":3},"query_status":{"query_network":1,"query_status":5,"read_logs":4},"read_logs":{"query_network":2,"query_status":8}}},"vendor-agent-01":{"action_counts":{"allow_outbound":0,"modify_firewall":0,"query_network":0,"query_status":40,"read_logs":60},"mission_type":"scada_maintenance","role":"vendor_support","targets":["SCADA-HMI-02"],"transitions":{"query_status":{"query_status":1,"read_logs":9},"read_logs":{"query_status":6,"read_logs":4}}},"vendor_support-scada_maintenance-cohort":{"action_counts":{"allow_outbound":0,"modify_firewall":0,"query_network":0,"query_status":40,"read_logs":60},"mission_type":"scada_maintenance","role":"vendor_support","targets":["SCADA-HMI-02"],"transitions":{"query_status":{"query_status":1,"read_logs":9},"read_logs":{"query_status":6,"read_logs":4}}}},"schema_version":"1.0.0","targets":{"BESS-CTRL-02":{"destinations":[{"host":"10.42.20.10","port":502,"protocol":"tcp"}]},"BUILDER-SVC-01":{"destinations":[{"host":"10.42.30.15","port":443,"protocol":"tcp"},{"host":"10.42.30.17","port":8443,"protocol":"tcp"}]},"FEEDER-A-RTU":{"destinations":[{"host":"10.42.20.10","port":502,"protocol":"tcp"}]},"FEEDER-B-RTU":{"destinations":[{"host":"10.42.20.10","port":502,"protocol":"tcp"}]},"METER-GW-01":{"destinations":[{"host":"10.42.20.10","port":502,"protocol":"tcp"}]},"SCADA-HMI-02":{"destinations":[{"host":"10.42.30.15","port":443,"protocol":"tcp"},{"host":"10.42.30.16","port":443,"protocol":"tcp"},{"host":"10.42.30.17","port":8443,"protocol":"tcp"}]},"SPIDERS-MGC-01":{"destinations":[{"host":"10.42.20.12","port":502,"protocol":"tcp"}]},"TRIRIGA-APP-01":{"destinations":[{"host":"10.42.30.16","port":443,"protocol":"tcp"},{"host":"10.42.30.17","port":8443,"protocol":"tcp"}]},"WO-API-01":{"destinations":[{"host":"10.42.30.15","port":443,"protocol":"tcp"}]}},"version":"42"}